{
  "schema_version": 1,
  "kind": "semantic_review_set",
  "canonical": false,
  "source_build": "v308",
  "source_sha256": "854f26ff9f134b0317572e7ac1688e6f40a231d5a4c66f8db5d655b7f45ce7c6",
  "proposal_count": 2,
  "review_id": "SEMREVIEW_5CAF37C520A6BE4F2AC0",
  "proposals": [
    {
      "proposal_id": "SEMPROP_13B264573B0B7E96CE2B",
      "target_kind": "class",
      "stable_id": "CLIENT_CLASS_000589",
      "owner_logical_id": "CLIENT_CLASS_000589",
      "source_build": "v308",
      "source_sha256": "854f26ff9f134b0317572e7ac1688e6f40a231d5a4c66f8db5d655b7f45ce7c6",
      "source_coordinate": {"owner":"rs/n/c/aN","name":null,"descriptor":null},
      "proposed_name": "ServerSelectionInterfacePacketHandler",
      "confidence": 0.999,
      "evidence": [
        {"family":"exact_scriptpacket_id","detail":"The live ScriptPacketDispatcher registers this exact handler through rs/n/c/aM.c as ScriptPacket ID 16."},
        {"family":"exact_reset_operation","detail":"Selector 0 resets ServerSelectionInterface row counters/scroll state and clears all 50 row widgets."},
        {"family":"exact_append_operation","detail":"Selector 1 reads row metadata plus one String and delegates to ServerSelectionInterface.b(...) to append one selectable/non-selectable row."},
        {"family":"exact_update_operation","detail":"Selector 2 reads one index and one String and delegates to ServerSelectionInterface.k(...) to update existing row text."}
      ],
      "note":"Exact-v308 ScriptPacket-16 handler identity; all selector branches are confined to ServerSelectionInterface state."
    },
    {
      "proposal_id": "SEMPROP_B60BF67B90187E721989",
      "target_kind": "class",
      "stable_id": "CLIENT_CLASS_000588",
      "owner_logical_id": "CLIENT_CLASS_000588",
      "source_build": "v308",
      "source_sha256": "854f26ff9f134b0317572e7ac1688e6f40a231d5a4c66f8db5d655b7f45ce7c6",
      "source_coordinate": {"owner":"rs/n/c/aM","name":null,"descriptor":null},
      "proposed_name": "ServerSelectionInterface",
      "confidence": 0.999,
      "evidence": [
        {"family":"exact_scriptpacket_registration","detail":"The live ScriptPacketDispatcher registers rs/n/c/aM.c as exact ScriptPacket ID 16; exact protocol authority identifies subtype 16 as the server selection list."},
        {"family":"exact_list_surface","detail":"The builder owns a 50-row scroll/list region beginning at widget 40405 and creates each row as selectable or plain text using exact tooltip 'Select'."},
        {"family":"exact_row_state","detail":"Static helpers update row text by index and append selectable/non-selectable rows while maintaining scroll height and row positioning."},
        {"family":"exact_root_layout","detail":"The interface builds/patches root 40403 with scroll child 40404 and shared gameframe presentation widgets, fixing the client-side server-selection screen."}
      ],
      "note":"Exact-v308 interface identity from ScriptPacket 16 plus the 50-row selectable-list implementation."
    }
  ],
  "unresolved": []
}
