{
  "schema_version": 1,
  "kind": "semantic_review_set",
  "canonical": false,
  "source_build": "v308",
  "source_sha256": "854f26ff9f134b0317572e7ac1688e6f40a231d5a4c66f8db5d655b7f45ce7c6",
  "proposal_count": 3,
  "review_id": "SEMREVIEW_0C940EC4C68D5DDC6CF0",
  "proposals": [
    {
      "proposal_id": "SEMPROP_0CD1AD892C4A033E20F1",
      "target_kind": "class",
      "stable_id": "CLIENT_CLASS_001124",
      "owner_logical_id": "CLIENT_CLASS_001124",
      "source_build": "v308",
      "source_sha256": "854f26ff9f134b0317572e7ac1688e6f40a231d5a4c66f8db5d655b7f45ce7c6",
      "source_coordinate": {"owner": "rs/y/c", "name": null, "descriptor": null},
      "proposed_name": "Scheduler",
      "confidence": 0.999,
      "evidence": [
        {"family":"exact_task_registry","detail":"Exact v308 rs/y/c owns a CopyOnWriteArrayList of ScheduledMethod records, exposes add/remove/read-only-list operations, and is injected with ScheduledExecutorService."},
        {"family":"exact_tick_behavior","detail":"Its scheduler pass compares Instant.now against each task interval, logs 'Scheduled task triggered: {}', updates last-run state, and invokes synchronously or through the executor according to Schedule.asynchronous."},
        {"family":"upstream_source_identity","detail":"RuneLite Scheduler source preserves the same logger strings, ScheduledMethod list, executor injection and invocation/error-handling behavior."}
      ],
      "note":"Verbatim upstream RuneLite source identity."
    },
    {
      "proposal_id": "SEMPROP_592193F9E3C091156288",
      "target_kind": "class",
      "stable_id": "CLIENT_CLASS_001122",
      "owner_logical_id": "CLIENT_CLASS_001122",
      "source_build": "v308",
      "source_sha256": "854f26ff9f134b0317572e7ac1688e6f40a231d5a4c66f8db5d655b7f45ce7c6",
      "source_coordinate": {"owner": "rs/y/a", "name": null, "descriptor": null},
      "proposed_name": "Schedule",
      "confidence": 0.999,
      "evidence": [
        {"family":"exact_annotation_contract","detail":"Exact v308 rs/y/a is a runtime method annotation exposing a long period, a ChronoUnit, and a boolean asynchronous flag."},
        {"family":"exact_scheduler_consumption","detail":"rs/y/c reads all three annotation attributes to decide elapsed interval and synchronous versus executor-backed invocation."},
        {"family":"upstream_source_identity","detail":"RuneLite source contains net.runelite.client.task.Schedule with the same method-target annotation role and period/unit/asynchronous scheduling contract."}
      ],
      "note":"Verbatim upstream RuneLite source identity."
    },
    {
      "proposal_id": "SEMPROP_7EFB8E37CCAA8E13556A",
      "target_kind": "class",
      "stable_id": "CLIENT_CLASS_001123",
      "owner_logical_id": "CLIENT_CLASS_001123",
      "source_build": "v308",
      "source_sha256": "854f26ff9f134b0317572e7ac1688e6f40a231d5a4c66f8db5d655b7f45ce7c6",
      "source_coordinate": {"owner": "rs/y/b", "name": null, "descriptor": null},
      "proposed_name": "ScheduledMethod",
      "confidence": 0.999,
      "evidence": [
        {"family":"exact_record_shape","detail":"Exact v308 rs/y/b stores Schedule annotation metadata, reflected Method, invocation target Object, optional Runnable lambda, and last-run Instant."},
        {"family":"exact_scheduler_role","detail":"Scheduler iterates these records, compares last-run time to the annotation interval, updates the timestamp and invokes either the Runnable or reflected method."},
        {"family":"upstream_source_identity","detail":"RuneLite source contains ScheduledMethod with the same Schedule/Method/Object/Runnable/Instant record shape."}
      ],
      "note":"Verbatim upstream RuneLite source identity."
    }
  ],
  "unresolved": []
}
