{
  "schema_version": 1,
  "kind": "semantic_review_set",
  "canonical": false,
  "source_build": "v308",
  "source_sha256": "854f26ff9f134b0317572e7ac1688e6f40a231d5a4c66f8db5d655b7f45ce7c6",
  "proposal_count": 3,
  "review_id": "SEMREVIEW_60B40BB14F542F1DC8C5",
  "proposals": [
    {
      "proposal_id": "SEMPROP_196E6CF1AE3105B77570",
      "target_kind": "class",
      "stable_id": "CLIENT_CLASS_000204",
      "owner_logical_id": "CLIENT_CLASS_000204",
      "source_build": "v308",
      "source_sha256": "854f26ff9f134b0317572e7ac1688e6f40a231d5a4c66f8db5d655b7f45ce7c6",
      "source_coordinate": {
        "owner": "rs/gui/b",
        "name": null,
        "descriptor": null
      },
      "proposed_name": "RuneLiteSubstanceSkin",
      "confidence": 0.999,
      "evidence": [
        {
          "family": "exact_resource_identity",
          "detail": "The skin loads the exact resource RuneLite.colorschemes and resolves many named schemes such as RuneLite Active, RuneLite Enabled, RuneLite Border, RuneLite Header Border and RuneLite Header Watermark."
        },
        {
          "family": "exact_display_name",
          "detail": "getDisplayName() returns the literal String 'RuneLite'."
        },
        {
          "family": "exact_substance_skin_role",
          "detail": "The class directly extends SubstanceSkin and configures color-scheme bundles, borders, marks, separators, title/header decoration areas, tab fades and overlay painters."
        }
      ],
      "note": "Exact-v308 RuneLite-branded Substance skin."
    },
    {
      "proposal_id": "SEMPROP_A836EA296BAE5083C9C4",
      "target_kind": "class",
      "stable_id": "CLIENT_CLASS_000259",
      "owner_logical_id": "CLIENT_CLASS_000259",
      "source_build": "v308",
      "source_sha256": "854f26ff9f134b0317572e7ac1688e6f40a231d5a4c66f8db5d655b7f45ce7c6",
      "source_coordinate": {
        "owner": "rs/gui/c",
        "name": null,
        "descriptor": null
      },
      "proposed_name": "SquareButtonShaper",
      "confidence": 0.999,
      "evidence": [
        {
          "family": "exact_shaper_contract",
          "detail": "The class extends Substance ClassicButtonShaper and overrides getCornerRadius(AbstractButton,float)."
        },
        {
          "family": "exact_square_behavior",
          "detail": "getCornerRadius always returns 0.0f for every button and size, forcing square button corners."
        },
        {
          "family": "exact_skin_ownership",
          "detail": "The shaper stores only its synthetic RuneLiteSubstanceSkin parent reference and has no unrelated styling behavior."
        }
      ],
      "note": "Descriptive exact-v308 name for the zero-corner-radius button shaper used by the RuneLite skin."
    },
    {
      "proposal_id": "SEMPROP_FBBC119C972A9F3BD201",
      "target_kind": "class",
      "stable_id": "CLIENT_CLASS_000202",
      "owner_logical_id": "CLIENT_CLASS_000202",
      "source_build": "v308",
      "source_sha256": "854f26ff9f134b0317572e7ac1688e6f40a231d5a4c66f8db5d655b7f45ce7c6",
      "source_coordinate": {
        "owner": "rs/gui/a",
        "name": null,
        "descriptor": null
      },
      "proposed_name": "RuneLiteLookAndFeel",
      "confidence": 0.999,
      "evidence": [
        {
          "family": "exact_substance_wrapper",
          "detail": "The class directly extends SubstanceLookAndFeel and its constructor delegates with a newly-created rs/gui/b skin instance."
        },
        {
          "family": "exact_skin_pair",
          "detail": "rs/gui/b is the exact RuneLite-branded SubstanceSkin, making rs/gui/a the concrete LookAndFeel wrapper for that skin."
        }
      ],
      "note": "Descriptive exact-v308 name for the Substance LookAndFeel wrapper around the RuneLite skin."
    }
  ],
  "unresolved": []
}
